{
  "$schema": "../schemas/claim.schema.json",
  "schema_version": "0.1.0",
  "id": "woh-claim-0030",
  "title": "The created creators",
  "version": "0.1.0",
  "lifecycle": "accepted",
  "statement": "Per the canon, the Elohim were themselves created: their civilization discovered that it too was the product of designers from elsewhere, who were created in turn — an unbounded chain of creation with no first creator, coherent with the infinite cosmos of woh-claim-0023; the corpus deploys the chain as the framework's answer to the who-designed-the-designer regress objection, converting the regress from a refutation into the canon's own cosmological structure.",
  "claim_kind": "interpretation",
  "framework_relation": "derived",
  "evidence_status": [
    "scoped",
    "contested"
  ],
  "public_label": "framework",
  "scope": {
    "includes": [
      "The canonical statement: the Elohim's own discovered createdness and their creation of life in turn — the chain running in both temporal directions without a first term",
      "The coherence link: an unbounded chain requires the unbounded cosmos woh-claim-0023 records; the two premises stand or fall together",
      "The argumentative deployment: the regress objection to design inference (the designer must have evolved or been designed) is accepted and absorbed — each designer is natural and created; no terminal designer is posited"
    ],
    "excludes": [
      "Any claim that the chain terminates or that a supreme being anchors it; the canon's atheism is constitutive here",
      "Evidence for the chain beyond the canon's report; the record is canon-derived",
      "The evolutionary origin of any given link's designers; the canon reports the chain, not its links' biology",
      "Design-inference arguments from terrestrial biology, which are woh-claim-0036's territory"
    ]
  },
  "source_references": [
    {
      "source_id": "the-book-which-tells-the-truth",
      "locator": "The passages on the Elohim's own creators and the continuation of the chain through humanity's future creations",
      "role": "canonical_basis",
      "access": "project_digitization",
      "note": "../../source-notes/the-book-which-tells-the-truth.md"
    },
    {
      "source_id": "extraterrestrials-took-me-to-their-planet",
      "locator": "The second message's development of the chain and its infinity",
      "role": "canonical_basis",
      "access": "project_digitization"
    },
    {
      "source_id": "crick-orgel-directed-panspermia",
      "locator": "The scientific formulation showing a created-life hypothesis is stateable without a terminal designer — formulability context, not endorsement",
      "role": "scientific_context",
      "access": "metadata_only"
    }
  ],
  "dependencies": [
    "woh-claim-0001",
    "woh-claim-0023"
  ],
  "alternatives": [
    {
      "id": "alt-0030-regress-unanswered",
      "statement": "An infinite chain does not answer the regress; it postpones explanation forever, and abiogenesis-plus-evolution somewhere remains the only terminating account."
    },
    {
      "id": "alt-0030-cosmological-conflict",
      "statement": "An unbounded past chain conflicts with standard cosmology's finite past; the chain inherits every objection to woh-claim-0023 plus a temporal one."
    },
    {
      "id": "alt-0030-mythic-pattern",
      "statement": "Creators-with-creators is a recurring theogonic pattern (divine genealogies); the canon's version modernizes the pattern rather than reporting a discovery."
    }
  ],
  "revision_triggers": [
    "Claim woh-claim-0001 or woh-claim-0023 is revised or retired.",
    "The canon's fuller context changes the chain's description.",
    "Public prose begins positing a terminal term or claiming evidential support, both of which this record excludes."
  ],
  "controlling_document": "../../docs/framework/created-creators.md",
  "public_derivatives": [
    "wheelofheaven/data-content:wiki/elohim.md",
    "wheelofheaven/data-content:articles/the-signature-and-the-designers.md",
    "wheelofheaven/data-content:wiki/cosmic-chain.md",
    "wheelofheaven/data-content:wiki/genesis-toolbox.md"
  ],
  "last_reviewed": "2026-08-16"
}
